id,source,sentence_1,sentence_2,label,binary-label
boostcamp-sts-v1-train-4454,nsmc-rtt,"초반에 와이어로 광역기를 시도했던 장면만 기억하는데, 그 외에는 정말 보기 안 좋고, 시간 낭비하고, 재미없고, 내용도 이상하고, 캡처한 와이어 장면 사진만 봐줬으면 좋겠다...",초반에는 와이어로 광역 캐스팅하는 장면만 기억에 남는다. 그 외에는 정말 못생기고 시간낭비이고 너무 웃기고 내용도 이상하다. 캡쳐된 와이어 장면만 봐도...,3.4,1.0
boostcamp-sts-v1-train-4455,slack-sampled,아직 잘 안 풀리네 ㅋㅋ,가보고 싶은 곳이 많다.,0.0,0.0
boostcamp-sts-v1-train-4456,petition-sampled,2019년 1월 1일 청와대에서 JTBC 뉴스룸을 방송해 주세요.,"2018년 3월 22일 새벽 2시, 아버지 같은 64세 어른이 31세 아들에게 폭행당했습니다.",0.0,0.0
boostcamp-sts-v1-train-4457,petition-sampled,택배기사 처우 개선 부탁드립니다.,"배달 기사님, 근본적인 처우 개선이 필요합니다.",3.8,1.0
boostcamp-sts-v1-train-4458,petition-rtt,홈쇼핑은 최소화해주세요.,홈쇼핑 최소화,3.6,1.0
boostcamp-sts-v1-train-4459,petition-sampled,우리는 자영업자들을 위한 정책이 필요하다.,지역균형발전을 위해서는 경기부양 정책이 필요하다.,0.2,0.0
boostcamp-sts-v1-train-4460,slack-rtt,우리 회사의 자부심과 AI의 빛. 챌린저스 팀과의 만남이라 긴장도 반 설레기도 했다.,우리 회사의 자부심과 AI의 빛. 도전자들을 만나는 것은 훨씬 더 긴장되고 반쯤 흥분된다.,4.2,1.0
boostcamp-sts-v1-train-4461,petition-sampled,반민족행위특별조사위원회 재창설,누진제 일시적 완화를 위한 에너지 특별 기금에 관한 특별법으로 설정한다.,0.0,0.0
boostcamp-sts-v1-train-4462,slack-rtt,저도 기대가 되니까 먼저 공유해보고 그 다음에 가도록 하겠습니다.,나도 기대가 되니까 라인 공유해서 검토하러 갈게!,2.8,1.0
boostcamp-sts-v1-train-4463,petition-sampled,증권사들도 투자 활성화로 경제활동을 활성화하는 방향으로 개혁해야 한다.,다주택자의 부동산 정책과 대출 규제로 지역 부동산이 죽는다.,0.0,0.0
boostcamp-sts-v1-train-4464,petition-sampled,통신사 포인트를 소외 계층이 사용할 수 있게 해주세요.,일반 대중이 LPG 자동차를 사용하도록 한다.,0.0,0.0
boostcamp-sts-v1-train-4465,petition-sampled,광주사태 유공자 명단 공개,518명의 유공자 명단을 받을 수 있을까요?,4.0,1.0
boostcamp-sts-v1-train-4466,slack-sampled,"와, 인증샷 정말 감사합니다!",오! 정말 고마워!,1.8,0.0
boostcamp-sts-v1-train-4467,nsmc-sampled,근데 season  밖에 없어서 아쉽다..,내용이 짧아서 아쉽다...,1.6,0.0
boostcamp-sts-v1-train-4468,slack-sampled,다시 하면 1로 바뀝니다.,후크팀 무대 많이 봐주세요.,0.0,0.0
boostcamp-sts-v1-train-4469,nsmc-sampled,"간단히 말해서, 쓰레기 영화입니다.","간단히 말해서, 쓰레기 영화입니다.",5.0,1.0
boostcamp-sts-v1-train-4470,petition-sampled,대통령은 국민을 안심시키고 비전을 제시하기 위해 국민에게 말해야 한다.,대통령의 일정을 밝히고 기자회견을 자주 해달라.,1.0,0.0
boostcamp-sts-v1-train-4471,petition-sampled,대한항공의 이름을 바꿔주세요.,대한항공의 이름을 바꿀 수 있나요?,4.0,1.0
boostcamp-sts-v1-train-4472,slack-sampled,7월에는 자유시간이 있을꺼야...c,"와, 벌써 다음 달이라니 믿을 수가 없어.",0.0,0.0
boostcamp-sts-v1-train-4473,nsmc-sampled,가볍게 보면 최고의 영화야!,정말 멋진 영화네요!,3.0,1.0
boostcamp-sts-v1-train-4474,slack-rtt,"와, 세 분 축하드립니다.",세 분 모두 축하드립니다.,4.8,1.0
boostcamp-sts-v1-train-4475,nsmc-sampled,진부한 말을 다루는 고전.,"신비한 장면의 반복, 지루함...",1.4,0.0
boostcamp-sts-v1-train-4476,slack-rtt,우리 회사에 입사한 것을 두 팔 벌려 환영합니다.,우리 회사에 오신 것을 두 팔 벌려 환영합니다.,3.8,1.0
boostcamp-sts-v1-train-4477,slack-sampled,하지만 나는 여전히 다른 것을 찾아야 해 하하.,내 손으로 하나 그려볼게 하하,0.0,0.0
boostcamp-sts-v1-train-4478,slack-rtt,필기를 하고 스스로 정리하는 능력이 대단하다고 생각했다.,필기를 하고 스스로 정리하는 힘이 대단하다고 확실히 생각했다.,4.0,1.0
boostcamp-sts-v1-train-4479,petition-rtt,사람들은 올바른 장소에 있어야 한다.,사람들이 올바른 장소에 있어야 하는가?,2.6,1.0
boostcamp-sts-v1-train-4480,slack-rtt,가을과 여름 해주세요!!!,가을과 여름을 돌보세요!,1.8,0.0
boostcamp-sts-v1-train-4481,slack-rtt,"제 설명이 맞았으면 좋겠고, 혹시 잘 아시는 분 있으면 알려주세요!","내 설명이 맞았으면 좋겠고, 아는 사람 있으면 말해줘!",4.4,1.0
boostcamp-sts-v1-train-4482,petition-sampled,중학생의 등교 시간을 늘립시다.,십대들의 학교 수업 시간을 줄인다.,0.4,0.0
boostcamp-sts-v1-train-4483,slack-rtt,나는 씨앗에서 샐러드로 자전거를 탔어!,씨앗에서 샐러드로 이어지는 주기!,3.6,1.0
boostcamp-sts-v1-train-4484,petition-sampled,네이버 댓글 실명제,네이버 댓글 실명제 신청합니다.,2.4,0.0
boostcamp-sts-v1-train-4485,petition-rtt,기관이 아닌 부모에게 보육료를 준다.,기관이 아닌 부모에게 보육료 지급,4.0,1.0
boostcamp-sts-v1-train-4486,nsmc-rtt,지금 보면 어떨지 모르겠지만 적어도 가장 감동적인 영화였다.,지금은 어떤지 모르겠지만 적어도 개봉 당시 가장 인상 깊었던 것은 영화였다.,3.2,1.0
boostcamp-sts-v1-train-4487,slack-sampled,이 부분은 공지에 더 잘 보이게 할게요!,이렇게 추가할게요.,0.0,0.0
boostcamp-sts-v1-train-4488,petition-rtt,스포츠 채널에서만 하는 스포츠,스포츠 채널에서만 하는 스포츠,3.0,1.0
boostcamp-sts-v1-train-4489,petition-sampled,제발요,당신의 도움을 진심으로 부탁드립니다.,4.0,1.0
boostcamp-sts-v1-train-4490,slack-rtt,주차는 조금 어려울 수 있습니다.,주차는 조금 어려울 수 있습니다.,3.6,1.0
boostcamp-sts-v1-train-4491,nsmc-sampled,완전 리얼 액션 작살입니다.,"간단히 말해서, 실망 그 자체...",0.0,0.0
boostcamp-sts-v1-train-4492,petition-sampled,성실한 마음으로 간청합니다. 도와줘.,하루아침에 직장에서 쫓겨나요. 도와 주세요,1.5,0.0
boostcamp-sts-v1-train-4493,petition-sampled,불법 조업 선박에 대응하기 위한 법 강화 중국,불법 중국어선 강력 대응 (침략 필요),3.2,1.0
boostcamp-sts-v1-train-4494,slack-rtt,(긴 휴가를 다녀왔는데...) 검증이 늦었습니다.),(긴 휴가 후...) 확인이 늦었습니다.),4.4,1.0
boostcamp-sts-v1-train-4495,petition-rtt,만약 전쟁이 일어난다면,만약 전쟁이 일어난다면,1.4,0.0
boostcamp-sts-v1-train-4496,nsmc-sampled,어떻게 이 두 개를 가지고 가서 똥을 싸요?,좋은 배우가 있어야 이 정도밖에 쓸 수 없다니.,2.0,0.0
boostcamp-sts-v1-train-4497,nsmc-sampled,위대한 개츠비를 잘 보여주는 영화,테러의 진실을 밝히는 영화!,0.8,0.0
boostcamp-sts-v1-train-4498,nsmc-rtt,데미가 뭐야...그렇기는 하지만.,데미는 어디에도 없지만...,0.4,0.0
boostcamp-sts-v1-train-4499,slack-sampled,오늘 쉬는 날이었지? 울음,어려운 일이었나요?,0.0,0.0
boostcamp-sts-v1-train-4500,petition-sampled,수시모집 대비 정시모집 확대,정시모집 최소정시모집 폐지 반대,2.5,1.0
boostcamp-sts-v1-train-4501,nsmc-sampled,이보다 더 지루할 순 없어,이보다 더 지루할 수는 없다.,1.6,0.0
boostcamp-sts-v1-train-4502,nsmc-sampled,극장에서 못 봐서 다행이야,영화관에서 못 봐서 다행이에요.,4.4,1.0
boostcamp-sts-v1-train-4503,slack-sampled,"날씨가 조금 따뜻해지면, 정말 가자!",기침을 하는데 코로나19가 아니길 바래,0.0,0.0
boostcamp-sts-v1-train-4504,nsmc-sampled,하품을 몇 번이나 했는지 모르겠어요.,나한테 뭘 보여주려는 건지 모르겠어,1.4,0.0
boostcamp-sts-v1-train-4505,nsmc-rtt,"아이들과 함께 볼 영화는 아니지만, 이번 여름에 정말 아이들을 위한 환상을 이루기 위해 이 영화를 봤는지 의심스럽다.",아이들과 함께 볼 수 있는 영화가 아니라 올 여름 아이들에게 꿈을 실현시켜주는 영화입니다.,2.0,0.0
boostcamp-sts-v1-train-4506,nsmc-sampled,내 예산을 들여도 이런 영화가 나오면 안 될 것 같아.,다시는 이런 영화 보고 싶지 않아.,1.4,0.0
boostcamp-sts-v1-train-4507,petition-rtt,홍일표 행정관 부부가 구속됐습니다.,홍일표 행정관과 부부의 체포 청원...,3.8,1.0
boostcamp-sts-v1-train-4508,petition-sampled,야간자율학습이 꼭 자기수양이 되었으면 좋겠다.,고등학교 야간 자율학습의 자율성을 강화해 주세요.,3.0,1.0
boostcamp-sts-v1-train-4509,petition-sampled,"고등학생 여러분, 문 닫으세요.",근로자의 휴식권을 찾아주세요.,0.0,0.0
boostcamp-sts-v1-train-4510,petition-rtt,"올림픽 개막식의 관점에서 보면, 1948년 우리의 공식 국기가 된 태극기가 1883년 대한제국부터 1919년 임시정부까지 이어졌으면 한다.","올림픽 개막식의 관점에서 1883년 대한제국의 태극기, 1919년 임시정부, 1948년 우리 국기가 된 태극기를 보고 싶다.",4.2,1.0
boostcamp-sts-v1-train-4511,nsmc-sampled,예상을 뛰어넘는 엄청난 인질극,슬픈 영혼 이야기.,0.0,0.0
boostcamp-sts-v1-train-4512,slack-sampled,타운홀 미팅 어때요?,목요일 오전으로 예정된 타운홀 미팅 일정에 대한 메모가 있나요?,1.0,0.0
boostcamp-sts-v1-train-4513,slack-sampled,아카이브에 많은 도움이 될 것 같아요!!,나중에 새로운 것을 공부할 때 많은 도움이 될 것 같아!,1.8,0.0
boostcamp-sts-v1-train-4514,nsmc-sampled,저는 반 고흐가 연기할 때 그랬을 거라는 인상을 받았어요.,나만 박현이의 연기를 못 본다고 느끼는 줄 알았는데 시청자 대부분이 나와 같은 생각을 한다.,0.5,0.0
boostcamp-sts-v1-train-4515,slack-rtt,"글쎄요, 앞으로도 그럴 것 같아요.",그럴 때마다,0.6,0.0
boostcamp-sts-v1-train-4516,petition-sampled,경북 안동지역 적폐의 표적이 안동지방선거를 거닐고 있다.,청탁을 받은 안동 출신 김재원 의원과 여 검사를 처벌하자.,0.4,0.0
boostcamp-sts-v1-train-4517,petition-sampled,우리는 실질적인 평등을 요구한다.,나는 국방부에 적폐청산을 요구한다.,0.2,0.0
boostcamp-sts-v1-train-4518,nsmc-rtt,코폴라를 연기와 연출의 거장으로 만든 '대부삼부작' 코스프레,"코폴라를 연기와 연출의 거장으로 만든 ""대부 3부작""의 코스프레.",3.6,1.0
boostcamp-sts-v1-train-4519,slack-sampled,나는 샌프란시스코에 있는 모히또를 정말 좋아해!,아아! 너무 예뻐요!!!!!,0.0,0.0
boostcamp-sts-v1-train-4520,petition-sampled,우리는 대출 규제를 강화해야 합니다!!!,환경관리가 더 철저하게 진행될 수 있도록 해주세요!!!!!,0.0,0.0
boostcamp-sts-v1-train-4521,slack-sampled,좋은 오후 보내고 있니?,좋은 오후 보내고 있니!,4.2,1.0
boostcamp-sts-v1-train-4522,nsmc-sampled,드라마 고마워요.,나는 원래 드라마를 잘 안 보는데 재미있어.,1.4,0.0
boostcamp-sts-v1-train-4523,petition-rtt,청소년보호법 폐지,청소년 보호법을 폐지해 주세요.,4.0,1.0
boostcamp-sts-v1-train-4524,slack-rtt,<PERSON> 님과의 운명적인 만남!,<PERSON>과의 운명적인 만남!,5.0,1.0
boostcamp-sts-v1-train-4525,petition-rtt,"다음 이재명 대통령, 친일 보수당과 싸우고, 살인범 이명박과 싸우고, 제가 볼 때는 김 해경 사건은 경찰의 허위 수사 결과입니다.","제가 볼 때는 다음 이재명 대통령 투쟁, 친일 보수파 킬러 이명박 투쟁, 김해 경궁 사건은 경찰 수사의 잘못된 결과입니다.",4.2,1.0
boostcamp-sts-v1-train-4526,slack-sampled,그는 내 집이 있는 도시를 구글 지도에서 직접 검색했다. ㅎㅎ,Google Drive에 폴더를 만들었습니다.,0.4,0.0
boostcamp-sts-v1-train-4527,petition-sampled,교환의 마감을 금지하십시오.,나는 암호화폐 거래소 폐지에 반대한다.,3.6,1.0
boostcamp-sts-v1-train-4528,nsmc-sampled,나만 속아넘어갈 순 없어,나만 그럴 순 없어,3.4,1.0
boostcamp-sts-v1-train-4529,nsmc-rtt,다른 사람들이 만드는 시각 무술 영화를 만들어 보세요. 궁중가위라는 표현으로 차별화가 두려웠지만 이것도 아니고 저것도 아닌 영화가 됐다.,그것은 다른 사람들이 하는 흔한 시각 무술 영화를 만든다. 왕 감독의 표현력으로 차별화를 꾀했지만 결과적으로 평범한 영화였다.,3.0,1.0
boostcamp-sts-v1-train-4530,petition-rtt,13년간 리얼매트 기술보증 및 대출 거부 기술보증기금 갑질 시정을 청원합니다.,가짜 실버매트 때문에 특허받은 리얼실버매트 기술보증과 대출을 13년간 거부한 기술보증기금에 진정합니다.,3.4,1.0
boostcamp-sts-v1-train-4531,slack-sampled,제가 호스트니까 시간 있으면 오세요.,가까이 오시면 저희가 꼭 차를 대접하겠습니다.,0.0,0.0
boostcamp-sts-v1-train-4532,slack-sampled,"그래, 나는 반성하고 산책할 거야!",나도 파티보이가 될 수 있어!,0.0,0.0
boostcamp-sts-v1-train-4533,slack-rtt,여행 사진을 보니 너무 부러웠고 나도 떠나고 싶었다.,여행 사진을 보니 너무 부러웠고 떠나고 싶었다.,3.8,1.0
boostcamp-sts-v1-train-4534,nsmc-sampled,너무 재밌어요. 네가 최고야!,정말 재미있어요!,3.6,1.0
boostcamp-sts-v1-train-4535,petition-rtt,국민연금의 대기업 주식이 재미있지 않았습니까?,국민연금 주식 재미있지 않았어?,1.8,0.0
boostcamp-sts-v1-train-4536,slack-sampled,고용보험과 근로복지공단에 대해서는 누구에게 물어봐야 하나요?,맨투맨 배송 문의는 어디로 연락해야 하나요?,1.0,0.0
boostcamp-sts-v1-train-4537,nsmc-sampled,기독교인으로서 많은 생각을 하게 만드는 영화이다.,생각나게 하는 경고.,0.6,0.0
boostcamp-sts-v1-train-4538,petition-rtt,"문재인 대통령님, 치솟는 집값 때문에 국민들이 죽어가고 있습니다!!",문재인 대통령 집값이 폭등하고 서민들 죽어가고 있어!!,4.2,1.0
boostcamp-sts-v1-train-4539,nsmc-sampled,신세경 때문에 다시 찾아봤어요.,신세경... 이종현 씨.,1.0,0.0
boostcamp-sts-v1-train-4540,slack-rtt,다음에 회식 때 직접 만나요!,다음 회의 때 보자!,2.8,1.0
boostcamp-sts-v1-train-4541,petition-sampled,"김기식 씨, 물러나세요. 대통령님, 신문을 보세요.",김기식을 처벌하려는 사람들을 조사해 주세요.,1.0,0.0
boostcamp-sts-v1-train-4542,slack-rtt,뉴스타에게 추천하고 싶은 책이 무엇인지 알려주세요.,당신이 추천하고 싶은 책을 뉴스타에게 알려주세요.,3.2,1.0
boostcamp-sts-v1-train-4543,nsmc-sampled,시청률에 따르면...,그래서 결론은 뭐죠?,0.0,0.0
boostcamp-sts-v1-train-4544,slack-rtt,우리를 크게 환영해 주세요!,모두를 따뜻하게 환영해!,1.6,0.0
boostcamp-sts-v1-train-4545,slack-sampled,"모델이 경쟁력이 있는 것은 아니지만, 모델의 편의성이 경쟁력이 있다는 점을 분명히 인식한 것으로 보인다.",이를 막기 위해 AI 모델에도 UX 관점이 필요하다는 점은 분명해 보인다.,0.2,0.0
boostcamp-sts-v1-train-4546,petition-sampled,"조치를 취해주세요, 법무부 장관님.",KT에 대해 검토 부탁드립니다.,0.0,0.0
boostcamp-sts-v1-train-4547,petition-rtt,"나경원, 올림픽 위원회 위원 해임해 주세요.",나경원 올림픽위원회 위원장 해임,3.6,1.0
boostcamp-sts-v1-train-4548,slack-rtt,"우와, 누가 오일장에서 나무를 살까 했더니(마당 있는 집이 부러워서) 바로 옆에 있더라.","우와, 그는 유전에서 누가 나에게 나무를 사주는지 보기 위해 바로 내 옆에 있었다.",2.6,1.0
boostcamp-sts-v1-train-4549,slack-rtt,그것은 T4로 구동된다고 한다.,T4에서 운행한다고 합니다.,3.8,1.0
boostcamp-sts-v1-train-4550,nsmc-sampled,나는 그래픽만 빼고 다 좋아한다.,그런데 그래픽이 좀 이상해요.,1.4,0.0
boostcamp-sts-v1-train-4551,nsmc-rtt,정말 잘 만든 영화 추천이야!,잘 만든 영화 추천...!!!,3.4,1.0
boostcamp-sts-v1-train-4552,slack-rtt,박수 한번 쳐드릴게요.,나는 박수로 참가했다.,3.4,1.0
boostcamp-sts-v1-train-4553,slack-rtt,그리고 그들은 우리에게 그들의 멋진 사진을 보내줬어!,그리고 그들은 나에게 멋진 냄비 사진을 보냈어!,4.2,1.0
boostcamp-sts-v1-train-4554,slack-sampled,여러분 안녕.,안녕하세요 여러분.,2.0,0.0
boostcamp-sts-v1-train-4555,nsmc-sampled,줄거리는요?,줄거리가 기대되요^^,1.0,0.0
boostcamp-sts-v1-train-4556,slack-rtt,"구룡역 근처에서 홍콩섬을 향해 바라본 하버뷰로, 한강 잔디밭처럼 텐트가 가득합니다.",구룡역에서 홍콩섬을 바라보는 하버뷰로 한강 잔디밭처럼 텐트가 가득하다.,3.8,1.0
boostcamp-sts-v1-train-4557,nsmc-sampled,음악도 좋아요 ^^,음악도 너무 좋아요 @@,3.8,1.0
boostcamp-sts-v1-train-4558,slack-sampled,그들 중 몇몇은 내가 보기엔 괜찮아 보인다. ㅋㅋㅋ,나는 항상 우리 반에 혼자 남았어...ㅋㅋㅋ,0.0,0.0
boostcamp-sts-v1-train-4559,petition-sampled,나는 초등돌봄교실이 지방정부로 이전되는 것을 반대한다.,나는 초등돌봄교실이 지방자치단체로 이전되는 것을 절대 반대한다.,4.2,1.0
boostcamp-sts-v1-train-4560,petition-sampled,용두산 공영주차장 직원들을 고발합니다.,용산에 영구임대아파트 건설을 제안합니다.,0.0,0.0
boostcamp-sts-v1-train-4561,petition-rtt,청원자와 동의자들은 왜 청원의 답변을 보지 못하는가?,청원란에 같은 청원서를 통합해 주세요.,0.8,0.0
boostcamp-sts-v1-train-4562,petition-rtt,영천을 신도시로 지정하다,영천신도시 지정,3.8,1.0
boostcamp-sts-v1-train-4563,nsmc-sampled,나는 마지막에 너무 많이 울었다.,내가 영화 보고 잘 안 울어서 네가 날 울렸어.,2.4,0.0
boostcamp-sts-v1-train-4564,slack-rtt,바닥이 안 보여.,바닥이 안 보여.,4.2,1.0
boostcamp-sts-v1-train-4565,petition-sampled,김관용 지사의 두 번째 거짓말,김관용 지사님 세 번째 거짓말 봐주세요.,2.0,0.0
boostcamp-sts-v1-train-4566,nsmc-rtt,"보는 사람마저도 철저히 우울하고 기분 나쁘게 하는데, 이런 영화를 만든 감독이나 배우들의 마음이 온전하지 않았나 하는 생각이 문득 든다.","시청자분들도 완전히 우울하고 속상해 하시는데, 이런 영화를 만든 감독님들과 배우들이 그대로 남아 있었는지 궁금하다.",3.4,1.0
boostcamp-sts-v1-train-4567,nsmc-rtt,"말도 안 되는 이야기고, 그건 불가능해.",믿을 수 없는 이야기다. 가망이 없다,2.2,0.0
boostcamp-sts-v1-train-4568,nsmc-sampled,즐거웠어요. 왜 이러는 거야?,즐거웠어요. 뭘 그렇게 심각하게 보고 있어요?,2.8,1.0
boostcamp-sts-v1-train-4569,slack-sampled,우리 가족과 함께 보니 정말 반갑다.,나는 그 장소에 다시 가고 싶다.,0.0,0.0
boostcamp-sts-v1-train-4570,slack-sampled,나는 여기서 송장을 수집했다.,여기 고해상도 버전 사진을 넣었습니다.,0.0,0.0
boostcamp-sts-v1-train-4571,nsmc-sampled,쓰레기는 아니지만 재미없다.,정치적 색상은 흥미롭지 않다.,2.2,0.0
boostcamp-sts-v1-train-4572,petition-sampled,대한축구협회의 새로운 조직개편을 요청합니다!,대한축구협회에 대한 국회의 감사를 강력히 촉구한다.,1.8,0.0
boostcamp-sts-v1-train-4573,petition-sampled,문재인 정권은 하루빨리 김기식의 사퇴를 발표해야 한다.,"청와대 특별감찰반 진상 규명, 조국·임종석 즉각 해임!",0.0,0.0
boostcamp-sts-v1-train-4574,petition-sampled,학교에 직장어린이집을 새로 열어주세요.,미용사 최저임금을 보장해 주세요.,0.0,0.0
boostcamp-sts-v1-train-4575,petition-sampled,Na Kyungwon씨 해고해 주세요.,나경원 씨 퇴출해야죠.,3.8,1.0
boostcamp-sts-v1-train-4576,petition-sampled,평창올림픽 어묵호떡 가격 논란 호떡 2개에 5000원,"이상호 2억원, 여자 컬링 0원...경기단체 포상금 '차이 폭이 넓다'가 현실인가.",0.0,0.0
boostcamp-sts-v1-train-4577,petition-sampled,나는 문재인 대통령을 사랑한다.,"문재인 대통령님, 저는 이것을 추천합니다.",0.6,0.0
boostcamp-sts-v1-train-4578,petition-sampled,국가 원수에 대한 예의가 없는 기사는 차단해 주세요.,다문화 가정에 대한 무분별한 혜택을 중단해 주세요.',0.0,0.0
boostcamp-sts-v1-train-4579,petition-sampled,비트코인이라는 것이 있다.,나는 비트코인의 폐쇄에 반대한다.,0.8,0.0
boostcamp-sts-v1-train-4580,nsmc-sampled,그게 공식적으로 출시되다니 믿을 수가 없어.,감독님이 이걸 만들어서 출시할 생각을 하다니.,3.0,1.0
boostcamp-sts-v1-train-4581,petition-sampled,국정원 플라스틱 케이스,장자연 사건을 재조사하고 싶습니다i,0.0,0.0
boostcamp-sts-v1-train-4582,nsmc-sampled,보고 재미없다고 하실 분들도 많으시네요.,결론은 보고 나면 허전해지는 영화입니다.,0.8,0.0
boostcamp-sts-v1-train-4583,slack-sampled,김치떡볶이라니...!!!!,떡볶이 마니아.침 흘리네...,1.4,0.0
boostcamp-sts-v1-train-4584,nsmc-rtt,이 느린 이야기는 모든 사람들의 잃어버린 세계이기 때문에 세계 감독들이 선택한 영화 역사상 최고의 영화가 될 수 있다.,일본 영화를 찾는 것은 아마도 우리가 가진 감정적인 동정 때문일 것이다.,0.0,0.0
boostcamp-sts-v1-train-4585,petition-sampled,조선소의 인력을 흡수하고 고용을 창출할 수 있는 국산 여객기를 만들어주세요.,저는 군 병원 대신 외부 병원을 이용하고 싶습니다.,0.0,0.0
boostcamp-sts-v1-train-4586,petition-rtt,비트코인은 온라인 게임 머니야...,비트코인은 온라인 게임 머니야...,3.6,1.0
boostcamp-sts-v1-train-4587,petition-rtt,김기식이 사퇴해야 하는 이유!!!,김기식 금융감독원장은 면직시켜주세요!,2.5,1.0
boostcamp-sts-v1-train-4588,slack-sampled,저녁에 후기를 남길게 하하!,당신이 알려준 대로 하고 후기를 남길게요.,2.8,1.0
boostcamp-sts-v1-train-4589,petition-sampled,강서구 PC방 살인사건,강서구 PC방 살인사건,3.6,1.0
boostcamp-sts-v1-train-4590,petition-sampled,청소년법을 폐지해 주세요.,청소년 보호법을 폐지해 주세요.,3.6,1.0
boostcamp-sts-v1-train-4591,slack-sampled,다음에 만나서 커피 마셔요!,나 이거 끼고 일할 거야!,0.0,0.0
boostcamp-sts-v1-train-4592,slack-sampled,그런데 서귀포시청은 대정읍에 비하면 도시다.,서귀포의 현재 모습입니다. 하하,1.0,0.0
boostcamp-sts-v1-train-4593,nsmc-sampled,말도 안 되는 영화...,계절이 지나치다.,0.0,0.0
boostcamp-sts-v1-train-4594,petition-rtt,어떤 보안법 개정도 실패하지 않을 것이다!!!!!~~,구법 개정은 완전히 실패했다!!!!! 안 돼!,1.6,0.0
boostcamp-sts-v1-train-4595,petition-sampled,친일재산회복법 제정 청원,김성수 친일재산 조사 및 환수조치 청원,2.8,1.0
boostcamp-sts-v1-train-4596,petition-sampled,다산신도시납품상황에서 국세 투입에 반대합니다.,다산신도시 정부지원 반대 의견 수렴 필요!!,2.0,0.0
boostcamp-sts-v1-train-4597,nsmc-rtt,생방송으로 보셨으니까 보기 힘드네요.,생방송을 보는 것조차 힘들어요.,3.8,1.0
boostcamp-sts-v1-train-4598,nsmc-sampled,감동이야.,나는 그 영화를 보고 정말 감명받았다.,3.0,1.0
boostcamp-sts-v1-train-4599,slack-sampled,무사히 돌아오길 바라면서...,꼭 이루어졌으면 좋겠어요!,0.4,0.0
boostcamp-sts-v1-train-4600,nsmc-sampled,내가 가본 적이 없는 곳의 향수와 느낌은... 그립다!,사랑을 느끼게 해주는 영화................................,0.0,0.0
boostcamp-sts-v1-train-4601,petition-sampled,지지율이 40%대라고요? 믿을 수가 없는 일이야!,"국민 50만 원, 공무원 200만 원! 웃기지도 않아!!!",0.0,0.0
boostcamp-sts-v1-train-4602,petition-rtt,국내 '건설 안전사고'에 대한 안전교육이 살길이다.,대한민국 '건설안전사고'의 안전교육만이 살길이다.,4.4,1.0
boostcamp-sts-v1-train-4603,nsmc-sampled,그녀는 너무 한심해.[울음],완전히 엉망진창이에요. 나는 그것을 추천하지 않는다.ㅜ,0.0,0.0
boostcamp-sts-v1-train-4604,nsmc-sampled,'수고했어! 수고했어!'라는 단어만 봤는데 재미가 좀 떨어지네요.,방금 전 영화가 재미없다는 걸 봤는데 너무 아쉬웠어요.,1.6,0.0
boostcamp-sts-v1-train-4605,petition-sampled,친애하는 문재인 대통령님,"문재인 제발, 대통령님",1.8,0.0
boostcamp-sts-v1-train-4606,slack-rtt,"아, 진취는 정말 귀여워!",그게 그렇게 귀여운지 어떻게 알아?,2.0,0.0
boostcamp-sts-v1-train-4607,slack-rtt,설정이 완료되면 알려 주십시오.,설정이 완료되면 저에게 알려주세요.,3.2,1.0
