id,source,sentence_1,sentence_2,label,binary-label
boostcamp-sts-v1-train-2142,nsmc-sampled,공포가 두렵지 않으면 게임은 끝난다.,공포 영화 공식을 따르면 무섭지 않다.,2.0,0.0
boostcamp-sts-v1-train-2143,slack-rtt,"다음에 모모야, 같이 먹자.",다음에는 엄마랑 밥 먹으러 올게요.,0.8,0.0
boostcamp-sts-v1-train-2144,slack-sampled,시험해 보세요.,가능한 한 빨리 이것을 사용해 보세요.,1.0,0.0
boostcamp-sts-v1-train-2145,petition-rtt,판매를 금지해 주십시오.,막아주세요,0.0,0.0
boostcamp-sts-v1-train-2146,nsmc-sampled,평론가에게 나쁜 점수를 받은 것이 부끄러워서 할 말을 잃는다.,말문이 막히다,2.6,1.0
boostcamp-sts-v1-train-2147,slack-sampled,감사합니다!!! ㅋㅋㅋ,"네, 감사합니다!ㅎㅎ",4.2,1.0
boostcamp-sts-v1-train-2148,nsmc-sampled,한국 시장에 구경꾼이 가득하다는 얘기다.,"간단히 말해서, 수술 중에 사용하면 즉시 사망할 수 있다.",0.0,0.0
boostcamp-sts-v1-train-2149,nsmc-rtt,불필요한 것에 대한 욕심을 버리지 못한 자신을 반성하는 시간이었다.,나의 부질없는 욕심을 버리지 못한 나를 돌아보는 시간이었다.,3.8,1.0
boostcamp-sts-v1-train-2150,nsmc-sampled,무엇보다 재미없다.,그냥 너무 지루해.,3.2,1.0
boostcamp-sts-v1-train-2151,nsmc-sampled,말이 필요 없는 걸작이다.,그것은 역사상 가장 위대한 걸작이다.,3.6,1.0
boostcamp-sts-v1-train-2152,petition-sampled,정부를 보세요,정부 및 고위 관리,1.4,0.0
boostcamp-sts-v1-train-2153,nsmc-sampled,"최고의 SF영화,..",역대 최고의 영화야.,2.2,0.0
boostcamp-sts-v1-train-2154,slack-sampled,오신 <PERSON> 에게 무한 감사드리며 … 갑자기 우리 회사 웨이 설명해주신 <PERSON> 에게도 감사..,"메뉴를 제안했고, <Person>은 레스토랑을 들여다보았고, <Person>은 확인 전화를 걸어 약속을 잡았다.",0.4,0.0
boostcamp-sts-v1-train-2155,slack-sampled,그리고 마지막으로 이태원 반에 나온 '단밤 포차'!,오픈클래스에 쉑쉑버거 까지 기억하셔서 정말 놀라웠어요.ㅎㅎ,0.0,0.0
boostcamp-sts-v1-train-2156,petition-sampled,"박원순 씨, 옥상 정치쇼 그만하세요.",옥탑방 전기세 누진제 폐지 부탁드립니다.,0.4,0.0
boostcamp-sts-v1-train-2157,nsmc-sampled,눈물도 많이 나고 감동도 많이 주는 영화.,"역시, 멋진 예술 작품들은 많은 사람들에게 감동을 줍니다.",2.0,0.0
boostcamp-sts-v1-train-2158,petition-sampled,배달 트럭에 대한 보복 신고,대형 트럭 가변 액슬 압력 조절...,0.2,0.0
boostcamp-sts-v1-train-2159,petition-sampled,65세 노인 복지 혜택 신규 지급을 연기해 주세요.,65세 이상 택시 자격 유지 법안 반대,0.2,0.0
boostcamp-sts-v1-train-2160,nsmc-sampled,1회부터 항상 보는 유일한 드라마 시작부터 끝까지 웃는 얼굴이 있어^^^^,오랜만에 즐겁게 드라마를 봤어요. 너무 재밌어요~~^^,1.8,0.0
boostcamp-sts-v1-train-2161,slack-sampled,다른 의견이 있으시면 댓글로 남겨주세요!,매우 대략적인 초안이니 부담없이 보시고 제안이나 건의사항 있으시면 말씀해주세요.,2.6,1.0
boostcamp-sts-v1-train-2162,nsmc-sampled,"재미있지만, 내 여동생은 짜증나.",하지만 난 남자다.,0.0,0.0
boostcamp-sts-v1-train-2163,nsmc-sampled,TV에 나오는 전기요금이 얼마나 낭비인가!,TV 전기세가 아깝다!!!,4.0,1.0
boostcamp-sts-v1-train-2164,petition-sampled,장자연 사건을 다시 조사해 주세요.,천안함 폭침 사건 재조사 바랍니다.,0.6,0.0
boostcamp-sts-v1-train-2165,slack-sampled,"아, 그렇군요... 설명해주셔서 감사합니다.",그들은 대중을 위한 것이라고 생각했을 것이다.,0.0,0.0
boostcamp-sts-v1-train-2166,nsmc-sampled,이런 영화가 있어요.,세상에 이런 영화가 있어요!,3.8,1.0
boostcamp-sts-v1-train-2167,petition-sampled,소년법 폐지! 사형제 폐지,제발! 소년법을 폐지하라!사형제도를 부활시켜라!!,2.8,1.0
boostcamp-sts-v1-train-2168,slack-sampled,조개 안 잡아요?ㅋㅋㅋ,설치는 다 끝냈죠? ㅎ,0.0,0.0
boostcamp-sts-v1-train-2169,nsmc-sampled,성장통의 공허함.,연결된 우연의 비참함.,0.2,0.0
boostcamp-sts-v1-train-2170,slack-sampled,한정판 같아.,그런 것 같아요.,0.0,0.0
boostcamp-sts-v1-train-2171,petition-sampled,자유한국당 해산 요청,"한국당, 즉각 해산 청원 촉구",3.8,1.0
boostcamp-sts-v1-train-2172,nsmc-sampled,집안이 가난해서 좌절감이 백 번이 아니었지만 부모님을 원망한 적은 없었다.,나는 아무런 정보도 없이 간 것을 후회했다.,0.0,0.0
boostcamp-sts-v1-train-2173,slack-sampled,주인님이 빨리 내려오라고 하시는 것 같아요. ㅋㅋㅋ,"아, 주인 없는 집에 갈 뻔했어요.",0.8,0.0
boostcamp-sts-v1-train-2174,petition-sampled,부실시공 단속 부탁드립니다.,편법을 단속해 주세요.,0.4,0.0
boostcamp-sts-v1-train-2175,slack-sampled,"네, 추가해주시면 다시 테스트해드리겠습니다.",공동작업자를 추가했습니다. 다시 시도하시겠습니까?,0.6,0.0
boostcamp-sts-v1-train-2176,slack-sampled,넌 정말 밝고 예쁘고 귀여웠어!,"오, 꽃들이 너무 예뻐요. 예쁘다!",1.8,0.0
boostcamp-sts-v1-train-2177,nsmc-sampled,내가 이렇게 했어야 했는지 몰랐어.,나는 시작과 발전이 좋았다.,2.0,0.0
boostcamp-sts-v1-train-2178,nsmc-rtt,"나중에, 그 아기는 졸았다.","나중에, 그 아기는 잠이 들었다.",3.6,1.0
boostcamp-sts-v1-train-2179,petition-sampled,소년법 폐지에 찬성하여,청소년보호법 폐지를 찬성합니다.,3.8,1.0
boostcamp-sts-v1-train-2180,petition-sampled,문신에 대한 법을 개정해 주세요.,정당방위법을 개정해 주세요.,0.6,0.0
boostcamp-sts-v1-train-2181,petition-sampled,산업연수생 제도의 문제점,고용 촉진 보조금의 문제,0.2,0.0
boostcamp-sts-v1-train-2182,nsmc-sampled,그들의 분노가 가득한 영화이다.,훌륭한 영화다.,0.4,0.0
boostcamp-sts-v1-train-2183,petition-sampled,신혼부부 특별공급 금수저 특별공급,신혼부부 특별공급 소득제한을 해제해주세요.,1.6,0.0
boostcamp-sts-v1-train-2184,nsmc-sampled,내 인생 최악의 한국 영화,내 인생 최악의 영화,3.4,1.0
boostcamp-sts-v1-train-2185,nsmc-sampled,너무 재밌고 감동적이었어 하하,너무 재밌었어요.,2.8,1.0
boostcamp-sts-v1-train-2186,slack-rtt,이야기를 나누면서 홍콩과 대만에 대한 추억을 공유했으니까 돈을 모아서 이사해서 동아시아로 가면 좋을 것 같아!,이야기를 나누면서 우리는 홍콩과 대만에 대한 추억도 공유했다.,2.4,0.0
boostcamp-sts-v1-train-2187,nsmc-sampled,울면서 독창성을 잃을 것 같아.,현실에는 존 커피가 있을 것 같다.,0.0,0.0
boostcamp-sts-v1-train-2188,nsmc-rtt,"썩은 정경유착, 썩은 홍차를 풍자하는 예술, 팽팽한 시나리오, 배우들의 연기까지 모두 최고다!","썩은 현장의 연맹, 썩은 검사의 오만한 풍자, 긴장감 넘치는 시나리오, 배우들의 연기, 모든 것이 최고다!",3.6,1.0
boostcamp-sts-v1-train-2189,petition-rtt,나는 특수 산업의 완전한 폐지를 요구한다.,특수산업 전면 폐지 요구,3.8,1.0
boostcamp-sts-v1-train-2190,nsmc-sampled,다큐멘터리 독립영화가 요즘 대세다. 비가 쏟아지고 있다.,영화가 아니라 다큐멘터리가... 말해줄께요.,1.4,0.0
boostcamp-sts-v1-train-2191,nsmc-sampled,이거 진짜 웃기다. 좋아요.,나왔을 때 되게 재밌었어요.,2.8,1.0
boostcamp-sts-v1-train-2192,slack-sampled,근데 1천원이면 일단 사고 보셔야? ㅋㅋ,그런데 한복 스타일은 괜찮나요?(웃음),0.0,0.0
boostcamp-sts-v1-train-2193,slack-sampled,멍한 표정으로 시작해서 30분 동안 기상 코스를 밟았어요 ㅋㅋ,나는 카페에서 졸다가 다시 일어났다.,1.0,0.0
boostcamp-sts-v1-train-2194,petition-sampled,조두순 석방 반대 요청,나는 조두순의 출소에 반대한다.,3.4,1.0
boostcamp-sts-v1-train-2195,slack-rtt,원본 이미지 또한 공유해주시면 감사하겠습니다.,이 이미지의 원본 이미지를 공유해주시면 감사하겠습니다...,3.8,1.0
boostcamp-sts-v1-train-2196,nsmc-sampled,나는 대학교 때 이 영화에 리포트를 제출했고 A를 받았다.,나는 이 영화를 중학교 때 봤다. 학년 때 봤는데 너무 재미있어서 용암만 봤어요.,0.2,0.0
boostcamp-sts-v1-train-2197,slack-sampled,나는 이 노래의 엄청난 팬이야 하하,내가 제일 좋아하는 노래야 하하,1.8,0.0
boostcamp-sts-v1-train-2198,nsmc-sampled,연기 잘하네. 그것은 좋은 작품이다.,좋은 프로그램 고마워 하하!,1.2,0.0
boostcamp-sts-v1-train-2199,petition-sampled,국민청원 제도를 폐지해 주세요.,청와대 국민청원 제도를 없애주세요.,4.2,1.0
boostcamp-sts-v1-train-2200,petition-rtt,전두환 전 대통령의 사자명예훼손 출판물을 기소하는 과정에서 검찰 수뇌부의 움직임도 볼 때 강원랜드 수사는 믿기 어렵다.,전두환 전 대통령의 명예훼손 출판물을 기소하는 과정에서 검찰 수뇌부가 움직이면 강원랜드 수사도 믿기지 않는다.,4.0,1.0
boostcamp-sts-v1-train-2201,slack-sampled,"만약 당신이 회사 근처에 산다면, 좋은 날에 꼭 가세요.",나는 제주도가 좋을 때 가고 싶다.,0.0,0.0
boostcamp-sts-v1-train-2202,nsmc-rtt,"좋아요, 아주 좋아요.","좋아요, 아주 좋아요.",4.0,1.0
boostcamp-sts-v1-train-2203,nsmc-rtt,그때 너무 재밌었어요.,그때 진짜 재밌었어요.,3.8,1.0
boostcamp-sts-v1-train-2204,slack-rtt,사족으로서 사무실은 물론 상현역 근처도 처음이라 놀라서 돌아다녔다.,사족이라 사무실과 상현역 주변은 처음이라 깜짝 놀랐다.,2.8,1.0
boostcamp-sts-v1-train-2205,petition-sampled,문재인 대통령의 국립중앙박물관 사진을 통한 경천사지 석탑 전시 개선,"이명박 1심 재판까지 오는 과정에서 수갑이 채워지지 않은 사진을 봤고, 사법부와 교도관들도 썩어 있었다.",0.0,0.0
boostcamp-sts-v1-train-2206,nsmc-sampled,"그게 편집되었다는 사실은... V-V-Tz 할 때 편집된 게 있어요. 이 노래와 같다)"")","강지환, 이지아 탈락!",0.0,0.0
boostcamp-sts-v1-train-2207,nsmc-sampled,비평가의 말을 듣지 마라.,돈 벌 생각은 하지 마.,0.0,0.0
boostcamp-sts-v1-train-2208,petition-sampled,특검 수사 거부권을 행사해주시기 바랍니다.,드루킹 사건에 대한 특검을 진행해 주세요.,0.4,0.0
boostcamp-sts-v1-train-2209,nsmc-sampled,기대하지 않고 따라하는 것이 더 재미있다.,"전혀 기대하지 않았는데, 정말 지루했어.",1.2,0.0
boostcamp-sts-v1-train-2210,slack-rtt,회사 워크숍에 갈까요? ㅋㅋ,회사 워크숍에 갈 거예요? ㅋㅋㅋ,1.8,0.0
boostcamp-sts-v1-train-2211,slack-sampled,아... 좋아요와 구독을 눌렀어!,난 여기 단골이야!,0.0,0.0
boostcamp-sts-v1-train-2212,slack-sampled,나는 그것이 꽤 정확했기 때문에 놀랐다.,매우 똑똑하지만 차갑다.,0.0,0.0
boostcamp-sts-v1-train-2213,nsmc-sampled,옛날 공이 클로즈업되던 당시의 방송 기술.,못이 발사되는 도구...,0.0,0.0
boostcamp-sts-v1-train-2214,nsmc-sampled,많은 사람들이 이 영화를 모른다.,나는 이 영화를 보고 선원이 되었다.,0.4,0.0
boostcamp-sts-v1-train-2215,nsmc-sampled,CG가 너무 황당해서 말을 못하겠다. 배우들의 연기는... 영어인데도 어색함이 많다.,"에릭 로버츠를 제외하고, 대부분의 출연자들은 매우 어색하다.콘텐츠 개발, 설정, 아이 같은 CG...역시 포스터만 그럴듯한데 정말 황당하고 조잡한 공포...영점",2.4,0.0
boostcamp-sts-v1-train-2216,petition-sampled,주휴수당을 취소해 주세요.,역학계의 최저임금을 보장해 주세요.,0.2,0.0
boostcamp-sts-v1-train-2217,slack-sampled,생각보다 한 달이 짧아서 아쉽네요! ㅋㅋ,너무 짧게 울었다.,3.2,1.0
boostcamp-sts-v1-train-2218,nsmc-sampled,내 인생 최고의 판타지,내 인생 최고의 애니메이션,1.8,0.0
boostcamp-sts-v1-train-2219,slack-rtt,"아, 그냥 궁금해서 물어본 거야.",그냥 궁금해서 물어본 거야.,4.0,1.0
boostcamp-sts-v1-train-2220,slack-sampled,오늘 운동 부끄럽게도 올립니다.,나도 수줍게 추천하는 노래야.,0.4,0.0
boostcamp-sts-v1-train-2221,nsmc-sampled,푹 빠졌네요. 강력추천만에.,"스토리, 연기력, 흥미, 몰입감",2.0,0.0
boostcamp-sts-v1-train-2222,nsmc-sampled,"솔직히, 한국 영화는 그들의 연기력으로 생계를 유지한다.",역시 연기력이 좀 아쉽네요...하지만 그 노래는 모든 것을 커버한다 하하,1.2,0.0
boostcamp-sts-v1-train-2223,petition-sampled,나는 그 법안의 폐지를 요구한다.,나는 그 법안의 수정과 폐지를 요청한다.,2.8,1.0
boostcamp-sts-v1-train-2224,petition-rtt,공무원연금과 국민연금이 차별받지 않는 세상을 만들어주세요.,"공무원연금, 국민연금, 차별 없는 세상을 만들어주세요.",4.6,1.0
boostcamp-sts-v1-train-2225,slack-sampled,이 음악이랑 비슷한 줄 알았어요.,세상에... 나는 이 사람이 타이핑이 정말 빠른 줄 알았어.,0.4,0.0
boostcamp-sts-v1-train-2226,slack-rtt,남은 시간 즐겁게 보내세요!!!,남은 시간 즐겁게 보내세요!!!,4.0,1.0
boostcamp-sts-v1-train-2227,petition-rtt,징벌적 손해배상법 10배~무기한 청원(미국 징벌적 손해배상법) 20만 가자!,제10차 징벌적 손해배상법 ~무기한 청원(미국 징벌적 손해배상법) 20만 가짜~!,2.8,1.0
boostcamp-sts-v1-train-2228,petition-sampled,장애인을 위한 대책을 세워주세요!,자영업 대책을 세워주세요.,0.6,0.0
boostcamp-sts-v1-train-2229,petition-sampled,나는 메디케어 인상에 반대한다.,저는 다문화 정책에 반대합니다!,0.0,0.0
boostcamp-sts-v1-train-2230,nsmc-rtt,왜 이렇게 만들었을까요?,왜 이렇게 만들었을까요?,4.8,1.0
boostcamp-sts-v1-train-2231,petition-sampled,대한항공 오너 세모 오너 정해진 해운 오너 소쿠리 주식회사의 공익사업을 근거로 무죄 체포장 무효를 신청합니다.,삼성바이오로직스 고의사기 배후에는 경총과 금융위원회가 고발하고 있다.,0.0,0.0
boostcamp-sts-v1-train-2232,petition-sampled,청소년 보호법 폐지 청원,청소년 보호법 폐지 청원,5.0,1.0
boostcamp-sts-v1-train-2233,slack-sampled,아주 좋아요. 여기 정말 좋아요.,와... 축하해!,0.0,0.0
boostcamp-sts-v1-train-2234,nsmc-sampled,너무 짧다,나는 너무 슬프고 화가 나.,2.2,0.0
boostcamp-sts-v1-train-2235,slack-sampled,축하합니다!하하하.,축하합니다! ㅎ,5.0,1.0
boostcamp-sts-v1-train-2236,slack-sampled,우리의 나눔 문화가 채용과도 연결돼 있다는 증거입니다!,"아, 이런 문화가 있었구나!",0.6,0.0
boostcamp-sts-v1-train-2237,petition-sampled,저는 국가 인재 양성법을 제안합니다.,국민연금 개혁안을 제안합니다!,0.0,0.0
boostcamp-sts-v1-train-2238,nsmc-sampled,저만 재밌어요?,저만 재밌어요?,4.2,1.0
boostcamp-sts-v1-train-2239,nsmc-rtt,나는 늘 누아르 코믹스에서 끔찍한 공포 영화를 만든다.,나는 매일 누아르 만화로 지루한 공포영화를 만들어.,2.2,0.0
boostcamp-sts-v1-train-2240,petition-sampled,곧 사라질 태권도 깃발!,재킷을 벗거나 바꿔주세요.,0.0,0.0
boostcamp-sts-v1-train-2241,slack-sampled,가끔 모이면 재미있을 것 같아.,걱정되긴 하지만 다음에 같이 뛰었으면 좋겠다.,0.4,0.0
boostcamp-sts-v1-train-2242,petition-sampled,매춘을 합법화해 주시기를 간청합니다.,청소년보호법 폐지를 호소합니다.,0.2,0.0
boostcamp-sts-v1-train-2243,nsmc-rtt,하하. 심심해.옷을 만드는 비용은 낭비이다.,지루해요. 옷을 만드는 비용은 낭비이다.,4.0,1.0
boostcamp-sts-v1-train-2244,petition-sampled,명예훼손을 적시에 제거해 주세요.,나는 사실상의 명예훼손죄가 폐지되기를 바란다.,4.2,1.0
boostcamp-sts-v1-train-2245,nsmc-sampled,일부러 해석한 게 아닌 것 같은데...,포스터에 있는 강인 언니 얼굴 보세요.,0.0,0.0
boostcamp-sts-v1-train-2246,nsmc-sampled,정말 재미있었어요! ㅎ,하나도 안 웃겼어요.,0.8,0.0
boostcamp-sts-v1-train-2247,nsmc-sampled,원작과 다르다면 감동적이어야 한다.,당신은 적어도 원래의 분위기를 살렸어야 했어요.,1.0,0.0
boostcamp-sts-v1-train-2248,nsmc-sampled,이 영화는... 하지만 90대에도 잊을 수가 없어요.,"D도 엉성해. 나는 아이들에게 동물들을 보여주기 위해 그것을 보았지만, 동물들이 거의 없다.",0.0,0.0
boostcamp-sts-v1-train-2249,slack-sampled,너무 시끄러워서... 기억에 남나요?ㅎㅎ,가장 기억에 남는 이야기는 탈진에 관한 것이었다.,1.0,0.0
boostcamp-sts-v1-train-2250,nsmc-sampled,평점이 정확한 영화,등급이 가장 적절합니다.,3.0,1.0
boostcamp-sts-v1-train-2251,slack-sampled,"영어 이름, 한국어 이름, 투 트랙, 영어 이름 빼기, 한국 이름은 '님'으로 하자.","모든 사람의 이름을 영어로 짓고 ""님""을 빼자.",2.2,0.0
boostcamp-sts-v1-train-2252,slack-sampled,나는 내가 생각나지 않은 디테일에 놀랐다.,인트로를 듣고 깜짝 놀랐어 ㅋㅋㅋ,1.0,0.0
boostcamp-sts-v1-train-2253,slack-sampled,오 마이 갓... 그렇군요!,"와, 어디야?",0.0,0.0
boostcamp-sts-v1-train-2254,slack-sampled,이 내용을 간단히 재현하면 다음과 같다.,이 양식이 나올 때까지의 의견을 간략하게 요약하면 다음과 같다.,2.0,0.0
boostcamp-sts-v1-train-2255,slack-sampled,"먼저, 테라스를 이용할 수 있습니다!","우선, 기네스! 맛있게 먹으면서 연기 연습해요!",0.0,0.0
boostcamp-sts-v1-train-2256,petition-sampled,그것은 세금 탄원서이다.,공무원 사무소에 대해 탄원하고 싶은데요,0.4,0.0
boostcamp-sts-v1-train-2257,slack-rtt,"전복 레드밴딩 바닷가재 정식, 전복 해물볶음밥 등","전복 새우정식, 전복 해물볶음밥 등",4.4,1.0
boostcamp-sts-v1-train-2258,petition-sampled,일자리를 막기 위한 과감한 규제혁신은 중단돼야 한다.,"우리는 한국의 성범죄에 대한 ""가벼운 처벌""을 개선할 필요가 있다.",0.0,0.0
boostcamp-sts-v1-train-2259,petition-rtt,"소액주주 1,000명 이상 기업 상장 의무화","소액주주 1,000명 이상 기업 상장 의무화",4.4,1.0
boostcamp-sts-v1-train-2260,nsmc-sampled,너무 지루한 영화도 영화다.,그 영화는 노래만큼 지루하다.,3.0,1.0
boostcamp-sts-v1-train-2261,slack-sampled,나도 한번 해봐야겠네요.,나중에 읽을게 하하,0.0,0.0
boostcamp-sts-v1-train-2262,slack-sampled,"오, 네가 직접 살 수 있을 것 같아!","오, 우리는 정말 좋은 시스템을 가지고 있어!",0.0,0.0
boostcamp-sts-v1-train-2263,nsmc-sampled,사랑스럽고 유쾌한 영화..^^,재미있는 영화예요. 순수해요.사랑해요,2.8,1.0
boostcamp-sts-v1-train-2264,nsmc-rtt,아주 좋아요. 아주 좋아요. 너무 더워요.,아주 좋아요! 아주 좋아요! 너무 신나요!,3.0,1.0
boostcamp-sts-v1-train-2265,nsmc-sampled,우리는 어떤 기준으로 기자와 비평가들을 뽑나요?!,언론평론가의 평점이 왜 그러는지 궁금하다.,0.8,0.0
boostcamp-sts-v1-train-2266,petition-sampled,사실 시기에 따른 명예훼손에 대해서는,적시에 명예훼손을 폐지해야 한다는 것이다.,1.2,0.0
boostcamp-sts-v1-train-2267,nsmc-sampled,이야기는 어렵지만 재미있었다.,생각보다 재미있었다.,2.6,1.0
boostcamp-sts-v1-train-2268,nsmc-sampled,영화에는 '규단교복X' 등 교육현실 등 가슴 아픈 추억이 가득하다.,감정을 조절하고 좀 더 객관적으로 있다가 갑자기 목이 메었으면 좋겠다. 가슴 아픈 영화,0.6,0.0
boostcamp-sts-v1-train-2269,nsmc-sampled,그 가족의 고통은 걸작이었다.,이것은 불후의 명작이다.,0.6,0.0
boostcamp-sts-v1-train-2270,petition-sampled,경제가 쇠퇴하고 있다.,노동자 계급의 경제가 죽어 가고 있다.,2.8,1.0
boostcamp-sts-v1-train-2271,slack-rtt,이게 무슨 약속이야?,어떤 종류의 약속이죠?,3.8,1.0
boostcamp-sts-v1-train-2272,slack-rtt,너의 포즈는 정말 믿음직스럽다.,"아, 포즈가 너무 듬직해요.",3.4,1.0
boostcamp-sts-v1-train-2273,petition-sampled,한반도기에 독도를 넣어주세요.,한반도기에 독도가 없는 경우 한반도기를 사용하지 마십시오.,2.6,1.0
boostcamp-sts-v1-train-2274,slack-sampled,"와, 우리가 떡을 준 게 3년 전 같은데, 1년 전이야.",우리끼리 놀았던 게 엊그제 같은데 벌써 5개월 전이라니 충격적이었어요.,0.0,0.0
boostcamp-sts-v1-train-2275,nsmc-sampled,정말 재밌네.,너무 웃기다,3.8,1.0
boostcamp-sts-v1-train-2276,slack-sampled,한 번만 따라해도 효과적이에요.,하루에 30분씩 하는 게 좋다고 들었는데 진짜인지 테스트해볼게요.,2.2,0.0
boostcamp-sts-v1-train-2277,nsmc-sampled,봄에 보는 것을 추천해요!,아무튼 꼭보시길!!ㅎㅎ,2.8,1.0
boostcamp-sts-v1-train-2278,petition-sampled,나는 남북한의 통일에 반대한다.,저는 남북 철도에 반대합니다.,0.8,0.0
boostcamp-sts-v1-train-2279,slack-sampled,다음에 새로운 사무실에서 만나자!,다음에 사무실에서 보자.,3.4,1.0
boostcamp-sts-v1-train-2280,nsmc-sampled,좋긴 한데 똥파리하고는 전혀 다른 영화야.,이상한 영화야.,0.2,0.0
boostcamp-sts-v1-train-2281,slack-sampled,제일 가까운 한분께 선물 드립니다. ㅋㅋ,그를 나에게 소개해 주세요. ㅋㅋㅋ,0.0,0.0
boostcamp-sts-v1-train-2282,nsmc-sampled,재밌어요. 별로인데요.,재밌어요.,3.6,1.0
boostcamp-sts-v1-train-2283,slack-sampled,"그나저나, 꽃줄기가 날 죽일지 뭔지 알아봐야겠어!","제가 좀 더 찾아봤는데 대리인처럼 보이는데, 실험을 해봐야겠어요.",0.0,0.0
boostcamp-sts-v1-train-2284,slack-rtt,"이곳은 재정적 지원보다는 GPU 인프라 지원, 마케팅, 할인 지원 등을 제공한다!","재정 지원이 아니라 GPU 인프라 지원, 마케팅, 할인 지원!",3.8,1.0
boostcamp-sts-v1-train-2285,petition-sampled,나도 암호화폐 거래를 하고 싶다.,암호화폐 거래소 폐지 및 규제 강화를 요청합니다.,1.0,0.0
boostcamp-sts-v1-train-2286,slack-rtt,"아니, 그렇지 않아요.",저런!,0.8,0.0
boostcamp-sts-v1-train-2287,petition-sampled,유권자 중 한 명으로서...,수능일 연기 관련해서...,0.0,0.0
boostcamp-sts-v1-train-2288,nsmc-sampled,나는 울었을 때 슬펐다.,반전. 슬퍼서 눈물이 날 뻔했어. 감동이야,0.8,0.0
boostcamp-sts-v1-train-2289,slack-rtt,주말에 먹어볼게 ㅋㅋㅋ,주말에 먹어볼게요.,3.8,1.0
boostcamp-sts-v1-train-2290,nsmc-sampled,내가 가장 싫었던 것은 평범하게 진행될 수 있는 이야기를 쓸데없는 반전으로 망치는 것이었다.,아담은 살아야 할 이유를 찾았다.,0.0,0.0
boostcamp-sts-v1-train-2291,nsmc-sampled,"나는 그것이 무서운 영화라고 생각했지만, 그것은 매우 감동적이었어.",실화라는 말에 더 감동적이었습니다.,2.2,0.0
boostcamp-sts-v1-train-2292,petition-rtt,나라가 행복해질까?,나라가 행복할까?,2.2,0.0
boostcamp-sts-v1-train-2293,petition-sampled,병역특례제도 개선안,공정성 문제로 인한 병역특례 폐지 요청,2.0,0.0
boostcamp-sts-v1-train-2294,slack-sampled,밥을 다 먹고 사진을 찍을까 해서 사진이...,합치면 인증샷이랑 헷갈려요.,0.0,0.0
boostcamp-sts-v1-train-2295,nsmc-sampled,대본 같은 이야기인데 아직도 허황된 이야기인가요?,난방 스토리의 설정이 무시되는 경우가 있다.,2.4,0.0
boostcamp-sts-v1-train-2296,slack-sampled,내 고양이는 한쪽 발을 벽에 붙이고 다른 한쪽 발을 구부린다 ㅋㅋㅋ,한 주를 되돌아보는 방법이 있나요?,0.0,0.0
boostcamp-sts-v1-train-2297,petition-sampled,프로 운동선수들에 대한 면제를 폐지해 주시기를 간청합니다.,선수 병역 특례 규정(병역면제) 폐지를 청원합니다.,3.4,1.0
boostcamp-sts-v1-train-2298,nsmc-rtt,박철수의 유작.,고 박철수 코치의 명복을 빌며...,2.4,0.0
boostcamp-sts-v1-train-2299,petition-sampled,대부분의 권장 사항 대신 중간 권장 사항에 응답하십시오.,청원 답변만 하지 말고 집행한 결과를 보여줘!!!1,0.4,0.0
boostcamp-sts-v1-train-2300,slack-sampled,우리 또 많은 이야기를 해요!,지금 바로 채널을 만들게요!,0.0,0.0
boostcamp-sts-v1-train-2301,petition-sampled,천안시내버스 노선이 편파적이라고 느껴 개선을 청원한다.,천안함 사건의 진상규명을 다시 해주시길 부탁드립니다.,0.0,0.0
boostcamp-sts-v1-train-2302,nsmc-sampled,아무리 노력해도 연기를 잘 못해서 정말 아쉬울 정도로...,이런 쓰레기 영화는 정말 오랜만이야. 진지하게,0.2,0.0
boostcamp-sts-v1-train-2303,petition-sampled,공청회를 열어주세요.,9월에 평양공동선언 공청회를 열어주세요.,2.0,0.0
boostcamp-sts-v1-train-2304,slack-sampled,일하다가 졸릴 때 듣기에 딱 좋은 곡이에요.,지금쯤이면 듣기 딱 좋은 노래예요.,1.8,0.0
boostcamp-sts-v1-train-2305,nsmc-rtt,그 영화는 매우 흔들린다.,그 영화는 매우 촌스럽다.,0.8,0.0
