id,source,sentence_1,sentence_2,label,binary-label
boostcamp-sts-v1-train-6743,nsmc-sampled,나도 프랭크가 되고 싶어.,나는 운명 같은 사람을 만나고 싶다.,0.6,0.0
boostcamp-sts-v1-train-6744,nsmc-rtt,아직도 내 마음속 깊이 남아 있는 영화야.,아직도 내 마음에 남는 영화야.,4.0,1.0
boostcamp-sts-v1-train-6745,nsmc-rtt,어설프고 황당한 마무리.,어처구니없는 결말이야.,2.6,1.0
boostcamp-sts-v1-train-6746,slack-sampled,"곰곰이 생각해 보면, 나는 과거에 그런 규칙들을 어렴풋이 기억하고 있다.",처음에는 이런 제도가 전혀 없었는데 만들어지니 너무 뿌듯하다.,0.0,0.0
boostcamp-sts-v1-train-6747,nsmc-rtt,다른 건 몰라도 두 시댁 식구들과 함께 돌잔치를 할 수 있어서 좋았다고 생각했다.,"다른 건 잘 모르겠고, 모든 시댁 식구들을 위한 축하와 이벤트로 가득한 돌잔치를 하면 좋을 것 같다는 생각이 들었다.",2.8,1.0
boostcamp-sts-v1-train-6748,slack-rtt,열심히 운동할 것을 약속합니다... (쥐추천) 버스 가는 길에 위스키 주문샵에 들러서 구경하고 다음에 헤어지고 싶을때 사갈게~!,열심히 운동할 것을 약속합니다... (쥐추천) 가는 길에 위스키바에 들러서 구경하고 다음에 욕심때문에 헤어지면 사갈게!,3.8,1.0
boostcamp-sts-v1-train-6749,nsmc-sampled,그냥 재미있다.,그냥 재밌어. ㅋㅋ,4.2,1.0
boostcamp-sts-v1-train-6750,petition-rtt,스파이 활동을 위한 현 정부를 정의하십시오.,나는 현 정부의 스파이 활동에 대한 정의를 요청합니다.,4.4,1.0
boostcamp-sts-v1-train-6751,petition-rtt,국내 라텍스 매트리스 전 제품 라돈 농도 긴급 측정 요청,국내 생산 라텍스 매트리스 전량 라돈 농도 측정 긴급요청,4.6,1.0
boostcamp-sts-v1-train-6752,nsmc-sampled,배우들의 연기력과 촬영기법이 잘 만들어진 영화다.,"아, 배우들의 연기는...진짜다",2.0,0.0
boostcamp-sts-v1-train-6753,slack-sampled,나는 잘 참여하고 있어 하하,배경 잘 쓰고 있어 하하,0.0,0.0
boostcamp-sts-v1-train-6754,slack-sampled,그의 고양이도 듣고 있다.,나는 내일 등산 갈 준비를 하고 있다.,0.0,0.0
boostcamp-sts-v1-train-6755,petition-sampled,2018년 제29회 공인중개사 시험에 이의 제기 지금뿐만 아니라 앞으로의 상황도 확인 부탁드립니다.,남북사업의 최우선 과제 중 역사 공동조사 부분을 포함시켜 주세요.,0.0,0.0
boostcamp-sts-v1-train-6756,nsmc-sampled,처음에는 재미있었어요.우자다 오픈한지 오래됐는지 모르겠다.,보기 좋은 드라마였어요. 누구 때문에 일찍 끝났어요. ;;;,1.2,0.0
boostcamp-sts-v1-train-6757,nsmc-sampled,데니를 실망시켰어,영상에서 봤지만 실망했어...,0.4,0.0
boostcamp-sts-v1-train-6758,nsmc-rtt,헐리우드처럼 제작비가 투입됐으면 얼마나 좋았을까.,할리우드처럼 제작비만 투자했다면 명작이 됐을 것이다.,4.0,1.0
boostcamp-sts-v1-train-6759,slack-sampled,기존 계정을 삭제한 후 새로운 계정으로 초대했습니다.,당신이 계정을 두 개 만들어서 그래요.,1.0,0.0
boostcamp-sts-v1-train-6760,slack-sampled,유행을 따르자.,이 잔에 이렇게 부어야 되는데.,0.4,0.0
boostcamp-sts-v1-train-6761,petition-rtt,한부모 복지 향상 지원,한부모 가정의 복지 증진에 도움,3.8,1.0
boostcamp-sts-v1-train-6762,nsmc-sampled,"와, 사람들을 화나게 할 목적으로 만들어진 영화야!!",정말 다른 말은 필요 없어 깊이 생각하게 하는 영화! 정말 최고야,1.0,0.0
boostcamp-sts-v1-train-6763,slack-sampled,이걸 테스트해 봐야겠어.,나 이거 먹어보고 싶어.,1.8,0.0
boostcamp-sts-v1-train-6764,slack-rtt,놀라운 정보 감사합니다.,좋은 정보 감사합니다.,3.8,1.0
boostcamp-sts-v1-train-6765,slack-rtt,"저도 아카펠라를 좋아해서 가끔 이 그룹을 찾아 듣는데, 개인적으로 윈도우 사운드 아카펠라가 최고예요!",나도 아카펠라를 좋아해서 가끔 이 그룹을 찾아서 듣기도 하지만 개인적으로 윈도우 사운드 아카펠라가 최고야!!,4.2,1.0
boostcamp-sts-v1-train-6766,nsmc-sampled,그래서 그런지 이 영화에 애착이 간다.,저는 영화를 하는 영화를 좋아해서 좋아하는 영화입니다.,0.8,0.0
boostcamp-sts-v1-train-6767,petition-sampled,가상화폐와 관련된 강력한 규제와 완벽한 법을 만들어주세요.,암호화폐 법을 제정해 주세요.,3.0,1.0
boostcamp-sts-v1-train-6768,petition-sampled,웅진씽크빅의 유상증자 조사 부탁드립니다.,소방용 드론 로봇을 만들어 주세요.,0.0,0.0
boostcamp-sts-v1-train-6769,nsmc-sampled,나는 한니발 시리즈가 가장 재미있었다.,방문자 시리즈에 관심이 있습니다.,1.2,0.0
boostcamp-sts-v1-train-6770,petition-sampled,자원외교 비리 수사 촉구,포스코 자원외교 비리 수사,2.8,1.0
boostcamp-sts-v1-train-6771,slack-sampled,나는 전에 휴머스를 먹어본 적이 없다. 참고할 만한 레시피가 있나요?ㅋㅋㅋ,모니터가 있는 공동 작업 공간이나 공유 사무실을 아는 사람 있나요?,0.0,0.0
boostcamp-sts-v1-train-6772,slack-sampled,아직 사진을 남길 수 없어서 프로필 사진 하나하나 합성했어요.,"첫 번째 사진을 확대하기 전까지, 나는 그것이 진짜라고 생각했다.",0.6,0.0
boostcamp-sts-v1-train-6773,petition-sampled,정시모집 확대해주세요.,수능을 확대해주세요.,4.0,1.0
boostcamp-sts-v1-train-6774,slack-sampled,저 대신 가 주세요.,그냥 날 보내줘.,0.0,0.0
boostcamp-sts-v1-train-6775,nsmc-sampled,시청자를 속이는 쇼 비즈니스는 옳지 않다.,시청자들을 우롱하는 대가,2.5,1.0
boostcamp-sts-v1-train-6776,petition-rtt,"Yeo Sang-gyu씨, 그를 해고해 주세요.",여상규를 없애주세요.,2.8,1.0
boostcamp-sts-v1-train-6777,nsmc-rtt,빌이 변하는 것을 보는 것은 재미있다.,빌이 바뀌는 것을 보는 것은 매우 재미있다.,3.8,1.0
boostcamp-sts-v1-train-6778,petition-rtt,"반복하는 정치인들, 제발 내가 정치로 돌아가지 않게 해주세요.",정치인들이 다시는 거짓말을 못하게 해주세요.,3.2,1.0
boostcamp-sts-v1-train-6779,nsmc-rtt,저는 MC가 언론에서 솔선수범하지 않는 것은 옳지 않다고 생각합니다.,나는 MC가 언론을 이끌지 않는 것은 옳지 않다고 생각한다.,3.8,1.0
boostcamp-sts-v1-train-6780,nsmc-sampled,슬퍼하고 싶으면 노래해도 돼. 뮤지컬 영화지만 어느 정도 발전해야 한다고 생각했다.,그리고요? 뮤지컬로 여러 번 이어졌잖아요.,1.6,0.0
boostcamp-sts-v1-train-6781,petition-sampled,이거 나야? 청와대로 모이자.,공매도를 폐지해주세요!! 여기가 나라인가요?,0.8,0.0
boostcamp-sts-v1-train-6782,petition-sampled,하이브리드 자동차의 고속도로 통행료 인하,터널이나 터널의 혼잡으로 인한 시간지연시 요금감면,1.0,0.0
boostcamp-sts-v1-train-6783,petition-rtt,네이버 실시간 검색 여론 조작에 대해 조사 부탁드립니다.,네이버 실시간 검색어 조작 의혹,2.8,1.0
boostcamp-sts-v1-train-6784,slack-sampled,"여러분, 정말 감사합니다.",당신을 위한 게시물이에요!,0.4,0.0
boostcamp-sts-v1-train-6785,slack-sampled,"우리는 정말 자기 축하, 와인, 사랑, 파티 등 다양한 이야기를 했어요!!",우리는 대학과 대학원 이야기부터 취미와 컴퓨터 하드웨어 이야기까지 다양한 이야기를 나누었습니다!,1.4,0.0
boostcamp-sts-v1-train-6786,petition-sampled,김정은의 서울 방문!!,제주도 난민 추방!!!!,0.0,0.0
boostcamp-sts-v1-train-6787,petition-sampled,나는 지역 어린이집에서 퇴원했다.,사립·공립어린이집의 학교급식대 문제점,0.6,0.0
boostcamp-sts-v1-train-6788,petition-sampled,발달 장애인을 위한 복지를 증진시켜 주세요.,"발달장애인, 원격의료 제공 부탁드립니다.",1.6,0.0
boostcamp-sts-v1-train-6789,nsmc-sampled,보면 볼수록 더 재미있어요!,정말 재미있게 봤어요!!!,2.0,0.0
boostcamp-sts-v1-train-6790,petition-sampled,자유한국당 해산,자유한국당 해산!,3.6,1.0
boostcamp-sts-v1-train-6791,nsmc-sampled,ㅋㅋㅋㅋㅋㅋㅋㅋㅋㅋㅋㅋㅋㅋㅋㅋㅋㅋㅋㅋㅋㅋㅋㅋㅋㅋㅋㅋㅋㅋㅋㅋㅋㅋㅋㅋㅋㅋ,".,등급 올릴게요.",0.8,0.0
boostcamp-sts-v1-train-6792,nsmc-sampled,너무 재밌어요. 이거 꼭 봐야 돼.,너무 웃겨. 너무 웃겨,2.8,1.0
boostcamp-sts-v1-train-6793,slack-sampled,"아, 맞아요. 예제에 집중하다 핵심 주제를 잊어버린 것 같다.",내가 왜 보스야?,0.0,0.0
boostcamp-sts-v1-train-6794,petition-rtt,불법숙박업 및 불법영업행위에 대한 제안 (참조바랍니다),불법숙박업 및 불법영업행위에 대한 제안( 참조),4.0,1.0
boostcamp-sts-v1-train-6795,nsmc-sampled,사우나는 강남에서도 가장 최신식이다.,"아니, 왜 시청률이 정각이야?",0.0,0.0
boostcamp-sts-v1-train-6796,nsmc-sampled,진짜내용도좋고연기도좋고!,음악도 좋고 스토리도 좋고,1.4,0.0
boostcamp-sts-v1-train-6797,petition-rtt,삼성 에어컨 리콜 청원,"삼성, 실외기 리콜 요구",5.0,1.0
boostcamp-sts-v1-train-6798,nsmc-rtt,재밌는 것 같아.,다 웃긴 것 같아요.,3.0,1.0
boostcamp-sts-v1-train-6799,petition-sampled,중국을 처벌해 주세요.,그를 제대로 처벌해 주세요.,0.0,0.0
boostcamp-sts-v1-train-6800,petition-sampled,방송개혁 재청구(내용 정정),일자리 창출에 대한 의견(국가민주해운회사 설립),0.0,0.0
boostcamp-sts-v1-train-6801,nsmc-sampled,영원히 이룰 수 없는 핀첼 커플,여자는 오늘 운전대에서 벗어날 수 없는 현실에서 탈출하는 꿈을 꾼다.,0.0,0.0
boostcamp-sts-v1-train-6802,slack-rtt,모든 음식이 너무 맛있어 보여서 배가 고파진다.,모든 음식이 너무 맛있어 보여서 배가 고프다.,3.8,1.0
boostcamp-sts-v1-train-6803,petition-sampled,난민을 받아들이지 마세요!,난민을 받아들이지 마세요!,4.0,1.0
boostcamp-sts-v1-train-6804,slack-sampled,그러나 위치는 남쪽 끝에 있습니다;;,T.T 간단한 수정인지는 모르겠지만;;,0.0,0.0
boostcamp-sts-v1-train-6805,nsmc-rtt,조금 실망스러웠는데... 오히려 러닝타임이 조금 더 길더라도 스토리를 원활하게 연결하고 싶다.,세부 사항 면에서 조금 실망스러웠습니다. 러닝타임이 조금 길더라도 이야기가 원활하게 연결됐으면 좋겠다.,4.0,1.0
boostcamp-sts-v1-train-6806,petition-rtt,KT 국제전화 정액요금제,KT 국제전화 정액요금제,5.0,1.0
boostcamp-sts-v1-train-6807,nsmc-sampled,정말 재미있었어요.,나는 그것을 정말 재미있게 봤다.,4.2,1.0
boostcamp-sts-v1-train-6808,slack-sampled,효과가 중요한 게 아니라 30분이 지나면 땀이 많이 나요.,"좋아, 좋아. 이렇게 더운 날에 운동을 하면 땀이 많이 나서 보람이 더 커요.",2.0,0.0
boostcamp-sts-v1-train-6809,slack-sampled,"아, 조만간 다시 회의에 갑시다.","오 이런, 여러분 환영합니다.",0.0,0.0
boostcamp-sts-v1-train-6810,slack-rtt,"사실이 아닌 것이 있을 테니, 업로드 될 것인지 확인해 주세요.",없을 수도 있으니 게시할 때 확인해주세요.,2.4,0.0
boostcamp-sts-v1-train-6811,nsmc-sampled,그것은 그 시대 최고의 무술 애니메이션 중 하나이다. :),최고의 애니메이션입니다.,2.4,0.0
boostcamp-sts-v1-train-6812,petition-sampled,노동시간을 줄이는 것은 살인이다.,주 52시간 근로시간 단축 부탁드립니다.,2.5,1.0
boostcamp-sts-v1-train-6813,nsmc-sampled,나는 그들의 노력에 박수를 보낸다.,나는 그들의 꿈과 열정에 박수를 보냅니다!,2.4,0.0
boostcamp-sts-v1-train-6814,slack-rtt,당신이 나의 횡설수설한 말을 아주 좋게 표현해줘서 감동이에요.,"흠, 아무 생각 없이 잘 표현해줘서 감동이야.",3.2,1.0
boostcamp-sts-v1-train-6815,petition-rtt,서민들이 맹위를 떨치고 있는 국가 재난 없는 정부.,서민들이 겪는 국가적 재난 없는 정부.,4.2,1.0
boostcamp-sts-v1-train-6816,nsmc-sampled,기독교 영화도 아니고 판타지 영화도 아니고...,영화도 아니고...,0.6,0.0
boostcamp-sts-v1-train-6817,petition-rtt,"공영방송·지상파방송·일반방송 등 TV광고에 대한 강제·무차별적 제한, 가입비 폐지 청원...","공영·지상파·일반방송 TV광고 강제·무차별 규제, 수신료 폐지 청원...",4.0,1.0
boostcamp-sts-v1-train-6818,petition-sampled,대구광역시교육청의 태풍안전수칙에 관한 연구,화재예방시스템 개선에 관한 연구,0.0,0.0
boostcamp-sts-v1-train-6819,nsmc-sampled,"오, 뭐-- 빛나는 아류차크--",정말 재미있지만 시청률은 항상 아쉽다.,0.0,0.0
boostcamp-sts-v1-train-6820,slack-sampled,로맨스가 폭발한다!!,"와, 이거 난이도가 높았어!!!!",0.0,0.0
boostcamp-sts-v1-train-6821,slack-sampled,스위스 융프라호에서 컵라면을 먹는 것은 한때 인기가 있었습니다.,저번에 보여줬던 모바일 모니터는 어떤 제품이었나요?,0.0,0.0
boostcamp-sts-v1-train-6822,slack-rtt,"크라브마, 시범 좀 보여줘 ㅋㅋㅋ",이리 와서 크라브마를 보여줘.,2.4,0.0
boostcamp-sts-v1-train-6823,petition-sampled,여기가 한국인가요?,여기가 한국인가요?,3.8,1.0
boostcamp-sts-v1-train-6824,slack-sampled,그는 철저한 디자이너이다.,나는 네가 디자이너인 줄 알았는데 아니더라 ㅋㅋ,1.0,0.0
boostcamp-sts-v1-train-6825,slack-sampled,이번 주 일요일에 제주에서 다시 만나요.,다음에 또 다른 곳에서 만나요!,1.8,0.0
boostcamp-sts-v1-train-6826,nsmc-rtt,"하지만 20년이 지난 지금에 와서 보면 어색한 특수효과나 연출도 있지만, 어떤 면에서는 당연하지만, 그런 것을 고려하지 않고 낮은 시청률을 주는 아이들이 많다.",하지만 20년이 지난 지금 특수효과와 연출은 어색하다.,2.4,0.0
boostcamp-sts-v1-train-6827,petition-sampled,법무장관 직선제...,사법부는 직설적일 필요가 있다.,1.2,0.0
boostcamp-sts-v1-train-6828,petition-sampled,삼성바이오로직스가 적자기업이라는 건 처음부터 알고 있었는데...,삼성바이오로직스는 그땐 옳았고 지금은 틀렸다... 그냥 투자자들인가요?,1.2,0.0
boostcamp-sts-v1-train-6829,nsmc-sampled,"최고의 무술 시나리오를 각색한 코미디, 초호화 캐스팅.","화려한 비주얼과 고급스러운 캐스팅, 하지만 그게 전부다.",1.6,0.0
boostcamp-sts-v1-train-6830,slack-rtt,두 번째 사진을 보면 광활한 광산 사냥의 세계를 맛볼 수 있다.,"두 번째 사진을 보면, 여러분은 지뢰 찾기의 광활한 세계를 즐길 수 있습니다.",4.2,1.0
boostcamp-sts-v1-train-6831,nsmc-sampled,힙합은 경쟁 장면에도 맞지 않는다.,나도 주인공을 더빙하는 것을 좋아하지 않아.,0.0,0.0
boostcamp-sts-v1-train-6832,slack-rtt,"아, 저도 매일 쓰고 있어요. 클릭","아, 매일 쓰지만 세게 눌러요.",1.0,0.0
boostcamp-sts-v1-train-6833,slack-sampled,저는 오늘 <Person>과 이야기하면서 즐거운 시간을 보냈습니다.,회식 덕분에 우리는 <Person>과 함께 사당에 모여 인도 음식을 즐겼다.,0.8,0.0
boostcamp-sts-v1-train-6834,slack-rtt,어제 <PERSON> 님과 즐거운 시간 보내고서는 까먹고 안올리고 있다가 올립니다. ㅋ,어제 <Person>과 즐거운 시간을 보냈는데 깜빡하고 올리지 못했어요. ㅋㅋㅋ,3.6,1.0
boostcamp-sts-v1-train-6835,petition-rtt,환경을 위해 카페에서 일회용 컵에 대해 지불한다.,환경을 위해 카페에서 일회용 컵 값을 지불한다.,3.8,1.0
boostcamp-sts-v1-train-6836,petition-sampled,일본 여행지로 지정해 주세요.,근로자의 날을 법정 공휴일로 지정해 주십시오.,0.0,0.0
boostcamp-sts-v1-train-6837,nsmc-sampled,여러모로 슬픈 영화,좋은 배우들이 나오는 슬픈 영화,3.0,1.0
boostcamp-sts-v1-train-6838,petition-sampled,나는 조두순이 출소하는 것을 반대한다.,나는 조두순의 출소를 반대한다.,5.0,1.0
boostcamp-sts-v1-train-6839,petition-sampled,"문재인, 물러나라.","국정 농단하는 문재인, 물러나라!",2.8,1.0
boostcamp-sts-v1-train-6840,petition-sampled,병원 직원 4명 이하로 근로기준법 개선 부탁드립니다.,5인 미만 사업장에 대한 근로기준법 예외 삭제 요청,0.8,0.0
boostcamp-sts-v1-train-6841,petition-sampled,부산현대해상화재보험,대전세무서장을 고발합니다.,0.6,0.0
boostcamp-sts-v1-train-6842,nsmc-sampled,졸기를 기대했는데 너무 실망이야.,나는 정말 재미있는 액션이 기대된다. 나는 그것을 추천하지 않는다.,1.2,0.0
boostcamp-sts-v1-train-6843,slack-sampled,"아, 이거 수입하는 사람이 아영이에요.","와, 이거 아이템이네요!",0.0,0.0
boostcamp-sts-v1-train-6844,petition-sampled,금융감독원장으로 주진형을 추천합니다.,주진형 금감원장이 차기 금감원장으로 추천된다.,4.0,1.0
boostcamp-sts-v1-train-6845,petition-sampled,국군기무사령부의 해체를 요청합니다.,기무사를 해체하고 국민연금을 폐지해 달라.,2.6,1.0
boostcamp-sts-v1-train-6846,nsmc-sampled,나는 그것을 내 주변 사람들에게 추천하고 싶다.,나는 그것을 내 주변 사람들에게 꼭 추천하고 싶다.,3.6,1.0
boostcamp-sts-v1-train-6847,slack-sampled,마침 냉동실에 병이 있어서 꺼냈어요.,찬장에서 좀 꺼내라.,1.4,0.0
boostcamp-sts-v1-train-6848,slack-sampled,뜬금없지만 땡땡이라는 표현이 너무 웃기다.,정말 즐거웠어!,1.6,0.0
boostcamp-sts-v1-train-6849,petition-rtt,누가 그들의 재산에 대한 이자를 갚나요?,부동산에 대한 이자는 누가 내나요?,2.4,0.0
boostcamp-sts-v1-train-6850,petition-sampled,정치인에 대한 최저 시급제를 시행해 주세요.,국민소환제를 빨리 시행해주세요!,0.0,0.0
boostcamp-sts-v1-train-6851,petition-rtt,"한국교통법 과태료, 면허취소 등의 법 제정이 꼭 필요하다.","과징금, 면허취소 등 대한민국 법제의 교통법이 절실하다.",3.5,1.0
boostcamp-sts-v1-train-6852,petition-sampled,이명박 전 대통령의 출국금지 청원,이명박 전 대통령의 출국을 금지해 주세요!!,3.8,1.0
boostcamp-sts-v1-train-6853,slack-sampled,그 전에 이해도를 높이면 좋을 것 같아서 공유하려고 합니다.,우리 회사 직원들도 한번 써보면 좋을 것 같아서 가지고 왔어요.,0.4,0.0
boostcamp-sts-v1-train-6854,petition-sampled,6학년 때는 장애인 전용차도 주차할 수 없나요?,근로자들이 쉴 수 있도록 법정공휴일을 법정공휴일로 지정할 수는 없나요?,0.0,0.0
boostcamp-sts-v1-train-6855,nsmc-sampled,창세기 소개 장면에서 스톰 터치.,브라질에서 세나가 이겼을 때 감동받았고 장면 후반부에 울었다. 최고입니다.,0.2,0.0
boostcamp-sts-v1-train-6856,nsmc-sampled,볼 때만 생각나는 영화,우리가 알고 싶은 것을 말해주지 않는 엉성한 영화,1.6,0.0
boostcamp-sts-v1-train-6857,slack-rtt,ㅋㅋㅋㅋㅋㅋㅋㅋㅋㅋㅋㅋㅋㅋㅋㅋㅋㅋ,"하하하하하, 나 신청했어.",0.6,0.0
boostcamp-sts-v1-train-6858,slack-sampled,짜잔~ 너무 맛있어.,"와, 조선의 맛. 정말 맛있을 것 같아!",1.4,0.0
boostcamp-sts-v1-train-6859,nsmc-sampled,나는 야구를 모르지만 재미있다.,재밌긴 한데...ㅍ,1.8,0.0
boostcamp-sts-v1-train-6860,slack-rtt,직장 생활 노하우 30가지,30 작업 노하우,3.4,1.0
boostcamp-sts-v1-train-6861,petition-sampled,소년법 개정. 키우기 무섭다.,"소년법을 개정·강화해 주시고, 필요하다면 폐지해 주시기 바랍니다.",2.0,0.0
boostcamp-sts-v1-train-6862,slack-rtt,나는 그를 보자마자 그것에 대해 말했다.,만나자마자 말했어 ㅋㅋ,3.4,1.0
boostcamp-sts-v1-train-6863,slack-sampled,언제 넣었어요?,그 멋진 사진을 어떻게 찍었어요?,0.0,0.0
boostcamp-sts-v1-train-6864,nsmc-rtt,어디로 가야 할지 방황하는 사람들과 이야기하고 있습니다. 걱정하지 마세요! 어디든 갈 수 있어요!,"어디로 갈지 고민하는 사람들을 위해, 걱정하지 마세요! 어디든 갈 수 있어요!",4.0,1.0
boostcamp-sts-v1-train-6865,petition-sampled,초등학교 학부모회 폐지,초등학교 방학 폐지 청원,1.0,0.0
boostcamp-sts-v1-train-6866,petition-sampled,그 야구팀의 두발 자유화,학생들의 두발 자유화,1.2,0.0
boostcamp-sts-v1-train-6867,petition-rtt,추천 순서대로 가상화폐를 검색하고 가장 추천된 기사에 댓글을 달아야 한다.,암호화폐 추천 순서대로 검색해서 추천글을 올려야 한다.,2.4,0.0
boostcamp-sts-v1-train-6868,slack-sampled,나는 일에 대해 이야기하는 것을 정말 좋아해서 언젠가 채팅하는 시간이 기대된다!,"일 이야기도 너무 재미있었지만, 잡담도 너무 재미있었어!",2.6,1.0
boostcamp-sts-v1-train-6869,nsmc-sampled,당신은 결국 울 건가요?,나는 아르바이트생에게 속았다.,0.0,0.0
boostcamp-sts-v1-train-6870,petition-rtt,가진 자들에게는 정말 무섭다.,(추측력) 그것을 가진 사람들에게는 정말 무섭다.,4.6,1.0
boostcamp-sts-v1-train-6871,petition-rtt,나는 내일 컬링 경기를 빨리 보고 싶다.,나는 내일 컬링 경기를 놓친다.,3.4,1.0
boostcamp-sts-v1-train-6872,nsmc-sampled,토이스토리와 함께 명작이라는 찬사를 받을 만하다.,토이스토리를 보신 분들은 이 영화를 좋아하실 거예요^^,2.0,0.0
boostcamp-sts-v1-train-6873,nsmc-sampled,왜 이렇게 멋있어?,재미없는데 왜 재밌다고 해요? 정말...,0.0,0.0
boostcamp-sts-v1-train-6874,petition-sampled,주택 융자에 대한 탄원서류를 제출합니다.,공무원 추가 합격에 대한 청원글을 올립니다.,0.2,0.0
boostcamp-sts-v1-train-6875,nsmc-rtt,그녀는 주인공처럼 보이지 않는다.,그 여주인공은 주인공처럼 보이지 않는다.,2.0,0.0
boostcamp-sts-v1-train-6876,petition-rtt,내가 자살하더라도 내 집에서 하게 해줘,"만약 내가 자살한다면, 내 집에서 하게 해줘.",4.2,1.0
boostcamp-sts-v1-train-6877,nsmc-rtt,"절대 추천하지 않은 영화, 진짜처럼 보이려고 노력했지만 동네 어린이 캠코더로 찍은 영상을 보며 머리가 아팠다.",추천할 만한 영화가 아니어서 사실적으로 만들려고 노력했지만 동네 어린이 캠코더가 촬영한 영상을 재생하다가 머리가 아파 죽는다.,3.6,1.0
boostcamp-sts-v1-train-6878,nsmc-sampled,그래서 내가 감당할 수 없는 거야.,나는 배슬기를 보러 갔을 때 매우 실망했다.,0.0,0.0
boostcamp-sts-v1-train-6879,slack-rtt,주말 밤에 나올 때가 더 무섭다.,주말 밤에 나오면 더 무섭다.,4.0,1.0
boostcamp-sts-v1-train-6880,slack-sampled,떡볶이 맛있겠다. 정말!,아웃백 툼바 맛있겠다.,0.4,0.0
boostcamp-sts-v1-train-6881,petition-rtt,당신은 항상 시대에 맞는 저소득층을 위한 지원책을 만들 건가요?,당신은 항상 시대에 맞는 저소득층을 지원하기 위한 계획을 세울 건가요?,3.2,1.0
boostcamp-sts-v1-train-6882,nsmc-rtt,그 영화의 분위기는 좋고 너무 사랑스러워!,영화 분위기도 좋고 영화도 너무 좋아!,3.2,1.0
boostcamp-sts-v1-train-6883,nsmc-sampled,촌스럽지 않고 재미있는 점이 많은 영화,너무 차분하고 감동적이었어요. 대사가 너무 좋았어요.,1.8,0.0
boostcamp-sts-v1-train-6884,slack-sampled,티백이랑 똑같아!,그리스 요거트인가요?,0.0,0.0
boostcamp-sts-v1-train-6885,slack-sampled,덕분에 우리가 몰랐던 것들을 많이 알 수 있었어 ㅋㅋ,내가 디자인 분야에 대해 아무것도 몰랐기 때문에 네가 너무 많이 가르쳐줬어!,0.0,0.0
boostcamp-sts-v1-train-6886,nsmc-rtt,고질라의 위엄은 압도되었다.,코지라의 위엄은 압도되었다.,3.6,1.0
boostcamp-sts-v1-train-6887,petition-sampled,8월 24일 공휴일로 지정,8월 24일을 임시 공휴일로 지정해 주세요.,3.0,1.0
boostcamp-sts-v1-train-6888,nsmc-sampled,돈이 좀 남은 것 같아요.,돈을 내지 않아서 다행이다.,0.6,0.0
boostcamp-sts-v1-train-6889,slack-rtt,"환절기에는 날씨에 따라 옷을 입는 것이 항상 어렵지만, 기온이나 흐린 바람에 따라 일정한 두께(?)의 옷을 알려준 사람이 있으면 좋겠다는 생각을 자주 한다.","변덕스러운 계절에 날씨에 따라 옷을 입는다는 것은 늘 어려운 일이지만, 기온, 흐린 날씨, 바람 등에 따라 옷이 얼마나 두꺼운(?)",2.4,0.0
boostcamp-sts-v1-train-6890,petition-sampled,지역 선거일을 연기해 주세요.,등교시간을 늦춰주세요,0.6,0.0
boostcamp-sts-v1-train-6891,nsmc-sampled,"군대를 다녀왔는데 개인으로서 단체생활에 피해를 주고 있는데, 그걸 만회하는 건가요?",성취감은 희생에서 오는가?,0.0,0.0
boostcamp-sts-v1-train-6892,petition-sampled,쓰레기통을 늘려주세요.,정시모집율을 올려주세요.,0.4,0.0
boostcamp-sts-v1-train-6893,slack-sampled,어제 강남에서 만난 이유는 <Person>과 직접 상의할 일이 있었기 때문입니다!,우리는 <Person>과 점심을 먹고 티타임을 가졌다!,0.8,0.0
